A1: 合并资产负债表 | F1: 销售净利率 | J1: 合并利润表
A2: 项目 | B2: 附注 | C2: 44561. | D2: 44196. | F2: 2021 | G2: 2020 | J2: 项目 | K2: 附注 | L2: 2021年度 | M2: 2020年度
A3: 流动资产： | F3: =L50/L4 -> 0.12355828009979149 | G3: =M50/M4 -> 0.12968330425096378 | J3: 一、营业总收入 | L3: 1233029658.53 | M3: 937742067.27999997
A4: 货币资金 | B4: 七、1 | C4: 574625929.67999995 | D4: 358663192.81 | J4: 其中：营业收入 | K4: 七、61 | L4: 1233029658.53 | M4: 937742067.27999997
A5: 结算备付金 | F5: 总资产周转率 | J5: 利息收入
A6: 拆出资金 | F6: 2021 | G6: 2020 | J6: 已赚保费
A7: 交易性金融资产 | B7: 七、2 | C7: 295728956.94 | D7: 40000000. | F7: =L4/C47 -> 0.54915573203268719 | G7: =M4/D47 -> 0.70295155409771226 | J7: 手续费及佣金收入
A8: 衍生金融资产 | J8: 二、营业总成本 | L8: 1044209756.14 | M8: 789448739.44000006
A9: 应收票据 | B9: 七、4 | D9: 1180477.73 | F9: 资产负债率2021 | G9: 2020 | J9: 其中：营业成本 | K9: 七、61 | L9: 897460584.72000003 | M9: 676894628.34000003
A10: 应收账款 | B10: 七、5 | C10: 686989771.09000003 | D10: 380046682.29000002 | F10: =C87/C47 -> 0.38353995881248404 | G10: =D87/D47 -> 0.4730410965097519 | J10: 利息支出
A11: 应收款项融资 | B11: 七、6 | C11: 4308340.2599999998 | D11: 63515095.469999999 | J11: 手续费及佣金支出
A12: 预付款项 | B12: 七、7 | C12: 22309697.48 | D12: 6218396.0599999996 | F12: 权益乘数 | G12: 2020 | J12: 退保金
A13: 应收保费 | F13: =1/(1-F10) -> 1.6221651578156679 | G13: =1/(1-G10) -> 1.8976811917905207 | J13: 赔付支出净额
A14: 应收分保账款 | F14: =G13-F13 -> 0.2755160339748528 | J14: 提取保险责任准备金净额
A15: 应收分保合同准备金 | J15: 保单红利支出
A16: 其他应收款 | B16: 七、8 | C16: 8636768.8699999992 | D16: 9090629.6300000008 | J16: 分保费用
A17: 其中：应收利息 | J17: 税金及附加 | K17: 七、62 | L17: 6041828.29 | M17: 3911240.9399999999
A18: 应收股利 | J18: 销售费用 | K18: 七、63 | L18: 44390860.539999999 | M18: 28441472.16
A19: 买入返售金融资产 | J19: 管理费用 | K19: 七、64 | L19: 43365167.659999996 | M19: 31635506.710000001
A20: 存货 | B20: 七、9 | C20: 182737006.94999999 | D20: 143258766.62 | J20: 研发费用 | K20: 七、65 | L20: 56186435.18 | M20: 38921613.289999999
A21: 合同资产 | B21: 七、10 | C21: 112698523.22 | D21: 119028616.22 | J21: 财务费用 | K21: 七、66 | L21: -3235120.25 | M21: 9644278.
A22: 持有待售资产 | J22: 其中：利息费用 | L22: 1546011.52 | M22: 5568630.9100000001
A23: 一年内到期的非流动资产 | J23: 利息收入 | L23: 6758420.8700000001 | M23: 2344150.25
A24: 其他流动资产 | B24: 七、13 | C24: 8710127.2799999993 | D24: 9410782.2200000007 | J24: 加：其他收益 | K24: 七、67 | L24: 8509584.7100000009 | M24: 5410716.6399999997
A25: 流动资产合计 | C25: 1896745121.77 | D25: 1130412639.05 | J25: 投资收益（损失以“－”号 | K25: 七、68 | L25: 2952049.6299999999 | M25: 1811654.0600000001
A26: 非流动资产： | J26: 填列）
A27: 发放贷款和垫款 | J27: 其中：对联营企业和合营企
A28: 债权投资 | J28: 业的投资收益
A29: 其他债权投资 | J29: 以摊余成本计量的金 | L29: -1665365.3799999999
A30: 长期应收款 | J30: 融资产终止确认收益
A31: 长期股权投资 | J31: 汇兑收益（损失以“－”号
A32: 其他权益工具投资 | J32: 填列）
A33: 其他非流动金融资产 | J33: 净敞口套期收益（损失以
A34: 投资性房地产 | J34: “-”号填列）
A35: 固定资产 | B35: 七、21 | C35: 89515424.319999993 | D35: 86882561.079999998 | J35: 公允价值变动收益（损失以 | K35: 七、70 | L35: 728956.93999999994
A36: 在建工程 | B36: 七、22 | C36: 167586572.11000001 | D36: 41322687.159999996 | J36: “－”号填列）
A37: 生产性生物资产 | J37: 信用减值损失（损失以 | K37: 七、71 | L37: -29125655.739999998 | M37: -5777512.29
A38: 油气资产 | J38: “-”号填列）
A39: 使用权资产 | B39: 七、25 | C39: 4002010.29 | D39: - | J39: 资产减值损失（损失以 | K39: 七、72 | L39: 3030308.1200000001 | M39: -6399520.6299999999
A40: 无形资产 | B40: 七、26 | C40: 37266289.670000002 | D40: 36732843.990000002 | J40: “-”号填列）
A41: 开发支出 | J41: 资产处置收益（损失以 | K41: 七、73 | L41: -68110.350000000006
A42: 商誉 | J42: “－”号填列）
A43: 长期待摊费用 | J43: 三、营业利润（亏损以“－”号填列） | L43: 174847035.69999999 | M43: 143338665.62
A44: 递延所得税资产 | B44: 七、30 | C44: 13453869.02 | D44: 10603568.460000001
A45: 其他非流动资产 | B45: 七、31 | C45: 36749456.859999999 | D45: 28052377.98 | J45: 加：营业外收入 | K45: 七、74 | L45: 5001.0799999999999 | M45: 3453177.6600000001
A46: 非流动资产合计 | C46: 348573622.26999998 | D46: 203594038.66999999 | J46: 减：营业外支出 | K46: 七、75 | L46: 1209999. | M46: 3616085.0600000001
A47: 资产总计 | C47: 2245318744.04 | D47: 1334006677.72 | J47: 四、利润总额（亏损总额以“－” | L47: 173642037.78 | M47: 143175758.22
A48: 流动负债： | J48: 号填列）
A49: 短期借款 | B49: 七、32 | C49: 45042458.32 | D49: 60064694.439999998 | J49: 减：所得税费用 | K49: 七、76 | L49: 21291013.859999999 | M49: 21566268.399999999
A50: 向中央银行借款 | J50: 五、净利润（净亏损以“－”号填 | L50: 152351023.91999999 | M50: 121609489.81999999
A51: 拆入资金 | J51: 列）
A52: 交易性金融负债 | J52: （一）按经营持续性分类
A53: 衍生金融负债 | J53: 1.持续经营净利润（净亏损以 | L53: 152351023.91999999 | M53: 121609489.81999999
A54: 应付票据 | B54: 七、35 | C54: 274586714.97000003 | D54: 174213649.33000001 | J54: “－”号填列）
A55: 应付账款 | B55: 七、36 | C55: 394173816.45999998 | D55: 315670565.80000001 | J55: 2.终止经营净利润（净亏损以
A56: 预收款项 | J56: “－”号填列）
A57: 合同负债 | B57: 七、38 | C57: 18538864.25 | D57: 26466171.550000001 | J57: （二）按所有权归属分类
A58: 卖出回购金融资产款 | J58: 1.归属于母公司股东的净利润 | L58: 152351023.91999999 | M58: 121609489.81999999
A59: 吸收存款及同业存放 | J59: （净亏损以“-”号填列）
A60: 代理买卖证券款 | J60: 2.少数股东损益（净亏损以
A61: 代理承销证券款 | J61: “-”号填列）
A62: 应付职工薪酬 | B62: 七、39 | C62: 20627951. | D62: 18155216.25 | J62: 六、其他综合收益的税后净额
A63: 应交税费 | B63: 七、40 | C63: 36224954.560000002 | D63: 18036636.969999999 | J63: （一）归属母公司所有者的其他
A64: 其他应付款 | B64: 七、41 | C64: 52847172.060000002 | D64: 1881432.77 | J64: 综合收益的税后净额
A65: 其中：应付利息 | J65: 1．不能重分类进损益的其他
A66: 应付股利 | J66: 综合收益
A67: 应付手续费及佣金 | J67: （1）重新计量设定受益计划变
A68: 应付分保账款 | J68: 动额
A69: 持有待售负债 | J69: （2）权益法下不能转损益的其
A70: 一年内到期的非流动负债 | B70: 七、43 | C70: 5280382.6100000003 | D70: 1001194.45 | J70: 他综合收益
A71: 其他流动负债 | B71: 七、44 | C71: 1647602.3799999999 | D71: 1532503.3400000001 | J71: （3）其他权益工具投资公允价
A72: 流动负债合计 | C72: 848969916.61000001 | D72: 617022064.89999998 | J72: 值变动
A73: 非流动负债： | J73: （4）企业自身信用风险公允价
A74: 保险合同准备金 | J74: 值变动
A75: 长期借款 | B75: 七、45 | C75: 11500000. | D75: 14017916.68 | J75: 2．将重分类进损益的其他综
A76: 应付债券 | J76: 合收益
A77: 其中：优先股 | J77: （1）权益法下可转损益的其他
A78: 永续债 | J78: 综合收益
A79: 租赁负债 | B79: 七、47 | C79: 699542. | J79: （2）其他债权投资公允价值变
A80: 长期应付款 | J80: 动
A81: 长期应付职工薪酬 | J81: （3）金融资产重分类计入其他
A82: 预计负债 | J82: 综合收益的金额
A83: 递延收益 | J83: （4）其他债权投资信用减值准
A84: 递延所得税负债 | J84: 备
A85: 其他非流动负债 | J85: （5）现金流量套期储备
A86: 非流动负债合计 | C86: 12199542. | D86: 14017916.68 | J86: （6）外币财务报表折算差额
A87: 负债合计 | C87: 861169458.61000001 | D87: 631039981.58000004 | J87: （7）其他
A88: 所有者权益（或股东权益）： | J88: （二）归属于少数股东的其他综
A89: 实收资本（或股本） | B89: 七、53 | C89: 125116500. | D89: 92932996. | J89: 合收益的税后净额
A90: 其他权益工具 | J90: 七、综合收益总额 | L90: 152351023.91999999 | M90: 121609489.81999999
A91: 其中：优先股 | J91: （一）归属于母公司所有者的综 | L91: 152351023.91999999 | M91: 121609489.81999999
A92: 永续债 | J92: 合收益总额
A93: 资本公积 | B93: 七、55 | C93: 806288058.91999996 | D93: 226862802.55000001 | J93: （二）归属于少数股东的综合收
A94: 减：库存股 | B94: 七、56 | C94: 46220795. | D94: - | J94: 益总额
A95: 其他综合收益 | J95: 八、每股收益：
A96: 专项储备 | J96: （一）基本每股收益(元/股) | L96: 1.31 | M96: 1.31
A97: 盈余公积 | B97: 七、59 | C97: 32496044.800000001 | D97: 21512533.690000001 | J97: （二）稀释每股收益(元/股) | L97: 1.31 | M97: 1.31
A98: 一般风险准备
A99: 未分配利润 | B99: 七、60 | C99: 466469476.70999998 | D99: 361658363.89999998
A100: 归属于母公司所有者权益 | C100: 1384149285.4300001 | D100: 702966696.13999999
A101: （或股东权益）合计
A102: 少数股东权益
A103: 所有者权益（或股东权 | C103: 1384149285.4300001 | D103: 702966696.13999999
A104: 益）合计
A105: 负债和所有者权益 | C105: 2245318744.04 | D105: 1334006677.72
A106: （或股东权益）总计